id,name
140101,Giáo dục học
140114,Quản lý giáo dục
140201,Giáo dục Mầm non
140202,Giáo dục Tiểu học
140203,Giáo dục Đặc biệt
140204,Giáo dục Công dân
140205,Giáo dục Chính trị
140206,Giáo dục Thể chất
140207,Huấn luyện thể thao
140208,Giáo dục Quốc phòng - An ninh
140209,Sư phạm Toán học
140210,Sư phạm Tin học
140211,Sư phạm Vật lý
140212,Sư phạm Hoá học
140213,Sư phạm Sinh học
140214,Sư phạm Kỹ thuật công nghiệp
140215,Sư phạm Kỹ thuật nông nghiệp
140217,Sư phạm Ngữ văn
140218,Sư phạm Lịch sử
140219,Sư phạm Địa lý
140221,Sư phạm Âm nhạc
140222,Sư phạm Mỹ thuật
140225,Sư phạm Tiếng Jrai
140226,Sư phạm Tiếng Khme
140227,Sư phạm Tiếng H'mong
140228,Sư phạm Tiếng Chăm
140231,Sư phạm Tiếng Anh
140232,Sư phạm Tiếng Nga
140233,Sư phạm Tiếng Pháp
140234,Sư phạm Tiếng Trung Quốc
140235,Sư phạm Tiếng Đức
140236,Sư phạm Tiếng Nhật
210101,Lý luận, lịch sử và phê bình mỹ thuật
210103,Hội hoạ
210104,Đồ hoạ
210105,Điêu khắc
210107,Gốm
210201,Âm nhạc học
210203,Sáng tác âm nhạc
210204,Chỉ huy âm nhạc
210205,Thanh nhạc
210207,Biểu diễn nhạc cụ phương tây
210208,Piano
210209,Nhạc Jazz
210210,Biểu diễn nhạc cụ truyền thống
210221,Lý luận và phê bình sân khấu
210225,Biên kịch sân khấu
210226,Diễn viên sân khấu kịch hát
210227,Đạo diễn sân khấu
210231,Lý luận và phê bình điện ảnh - truyền hình
210233,Biên kịch điện ảnh - truyền hình
210234,Diễn viên kịch - điện ảnh
210235,Đạo diễn điện ảnh - truyền hình
210236,Quay phim
210241,Lý luận, phê bình múa
210242,Diễn viên múa
210243,Biên đạo múa
210244,Huấn luyện múa
210301,Nhiếp ảnh
210302,Công nghệ điện ảnh - truyền hình
210303,Thiết kế âm thanh - ánh sáng
210402,Thiết kế công nghiệp
210403,Thiết kế đồ họa
210404,Thiết kế thời trang
210405,Thiết kế nội thất
210406,Thiết kế mỹ thuật sân khấu - điện ảnh
220101,Tiếng Việt và văn hoá Việt Nam
220104,Hán Nôm
220105,Ngôn ngữ Jrai
220106,Ngôn ngữ Khme
220107,Ngôn ngữ H'mong
220108,Ngôn ngữ Chăm
220110,Sáng tác văn học
220112,Văn hoá các dân tộc thiểu số Việt Nam
220113,Việt Nam học
220201,Ngôn ngữ Anh
220202,Ngôn ngữ Nga
220203,Ngôn ngữ Pháp
220204,Ngôn ngữ Trung Quốc
220205,Ngôn ngữ Đức
220206,Ngôn ngữ Tây Ban Nha
220207,Ngôn ngữ Bồ Đào Nha
220208,Ngôn ngữ Italia
220209,Ngôn ngữ Nhật
220210,Ngôn ngữ Hàn Quốc
220211,Ngôn ngữ Ảrập
220212,Quốc tế học
220213,Đông phương học
220214,Đông Nam Á học
220215,Trung Quốc học
220216,Nhật Bản học
220217,Hàn Quốc học
220218,Khu vực Thái Bình Dương học
220301,Triết học
220310,Lịch sử
220320,Ngôn ngữ học
220330,Văn học
220340,Văn hoá học
220342,Quản lý văn hoá
220343,Quản lý thể dục thể thao
310101,Kinh tế
310106,Kinh tế quốc tế
310201,Chính trị học
310202,Xây dựng Đảng và chính quyền nhà nước
310205,Quản lý nhà nước
310206,Quan hệ quốc tế
310301,Xã hội học
310302,Nhân học
310401,Tâm lý học
310403,Tâm lý học giáo dục
310501,Địa lý học
310502,Bản đồ học
320101,Báo chí
320104,Truyền thông đa phương tiện
340406,Công nghệ truyền thông
360708,Quan hệ công chúng
320201,Thông tin học
320202,Khoa học thư viện
320303,Lưu trữ học
320305,Bảo tàng học
320401,Xuất bản
320402,Kinh doanh xuất bản phẩm
340101,Quản trị kinh doanh
340103,Quản trị dịch vụ du lịch và lữ hành
340107,Quản trị khách sạn
340109,Quản trị nhà hàng và dịch vụ ăn uống
340115,Marketing
340116,Bất động sản
340120,Kinh doanh quốc tế
340121,Kinh doanh thương mại
340201,Tài chính – Ngân hàng
340202,Bảo hiểm
340301,Kế toán
340302,Kiểm toán
340401,Khoa học quản lý
340404,Quản trị nhân lực
340405,Hệ thống thông tin quản lý
380101,Luật
380107,Luật kinh tế
380108,Luật quốc tế
420101,Sinh học
420201,Công nghệ sinh học
420202,Kỹ thuật sinh học
420203,Sinh học ứng dụng
440101,Thiên văn học
440102,Vật lý học
440112,Hoá học
430122,Khoa học vật liệu
440201,Địa chất học
440217,Địa lý tự nhiên
440221,Khí tượng học
440224,Thuỷ văn
440228,Hải dương học
440301,Khoa học môi trường
440306,Khoa học đất
460101,Toán học
460112,Toán ứng dụng
460115,Toán cơ
460201,Thống kê
480101,Khoa học máy tính
480102,Truyền thông và mạng máy tính
480103,Kỹ thuật phần mềm
480104,Hệ thống thông tin
480201,Công nghệ thông tin
510102,Công nghệ kỹ thuật công trình xây dựng
510103,Công nghệ kỹ thuật xây dựng
510104,Công nghệ kỹ thuật giao thông
510105,Công nghệ kỹ thuật vật liệu xây dựng
510201,Công nghệ kỹ thuật cơ khí
510202,Công nghệ chế tạo máy
510203,Công nghệ kỹ thuật cơ điện tử
510205,Công nghệ kỹ thuật ô tô
510206,Công nghệ kỹ thuật nhiệt
510210,Công thôn
510301,Công nghệ kỹ thuật điện, điện tử
510302,Công nghệ kỹ thuật điện tử, truyền thông
510303,Công nghệ kỹ thuật điều khiển và tự động hóa
510304,Công nghệ kỹ thuật máy tính
510401,Công nghệ kỹ thuật hoá học
510402,Công nghệ vật liệu
510406,Công nghệ kỹ thuật môi trường
510601,Quản lý công nghiệp
510602,Kỹ thuật hệ thống công nghiệp
510603,Kỹ thuật công nghiệp
510604,Kinh tế công nghiệp
520101,Cơ kỹ thuật
520103,Kỹ thuật cơ khí
520114,Kỹ thuật cơ - điện tử
520115,Kỹ thuật nhiệt
520120,Kỹ thuật hàng không
520122,Kỹ thuật tàu thuỷ
520201,Kỹ thuật điện, điện tử
520207,Kỹ thuật điện tử, truyền thông
520212,Kỹ thuật y sinh
520214,Kỹ thuật máy tính
520216,Kỹ thuật điều khiển và tự động hoá
520301,Kỹ thuật hoá học
520309,Kỹ thuật vật liệu
520310,Kỹ thuật vật liệu kim loại
520320,Kỹ thuật môi trường
520401,Vật lý kỹ thuật
520402,Kỹ thuật hạt nhân
520501,Kỹ thuật địa chất
520502,Kỹ thuật địa vật lý
520503,Kỹ thuật trắc địa - bản đồ
520504,Kỹ thuật biển
520601,Kỹ thuật mỏ
520604,Kỹ thuật dầu khí
520607,Kỹ thuật tuyển khoáng
540101,Công nghệ thực phẩm
540104,Công nghệ sau thu hoạch
540105,Công nghệ chế biến thuỷ sản
540201,Kỹ thuật dệt
540202,Công nghệ sợi, dệt
540204,Công nghệ may
540206,Công nghệ da giày
540301,Công nghệ chế biến lâm sản
580102,Kiến trúc
580105,Quy hoạch vùng và đô thị
580110,Kiến trúc cảnh quan
580201,Kỹ thuật công trình xây dựng
580203,Kỹ thuật công trình biển
580205,Kỹ thuật xây dựng công trình giao thông
580208,Kỹ thuật xây dựng
580210,Địa kỹ thuật xây dựng
580212,Kỹ thuật tài nguyên nước
580301,Kinh tế xây dựng
580302,Quản lý xây dựng
620101,Nông nghiệp
620102,Khuyến nông
620105,Chăn nuôi
620109,Nông học
620110,Khoa học cây trồng
620112,Bảo vệ thực vật
620113,Công nghệ rau hoa quả và cảnh quan
620114,Kinh doanh nông nghiệp
620115,Kinh tế nông nghiệp
620116,Phát triển nông thôn
620201,Lâm nghiệp
620202,Lâm nghiệp đô thị
620205,Lâm sinh
620211,Quản lý tài nguyên rừng
620301,Nuôi trồng thuỷ sản
620302,Bệnh học thủy sản
620304,Kỹ thuật khai thác thủy sản
620305,Quản lý nguồn lợi thủy sản
640101,Thú y
720101,Y đa khoa
720201,Y học cổ truyền
720301,Y tế công cộng
720305,Y sinh học thể dục thể thao
720330,Kỹ thuật y học
720332,Xét nghiệm y học
720333,Vật lý trị liệu, phục hồi chức năng
720401,Dược học
720501,Điều dưỡng
720601,Răng - Hàm - Mặt
720602,Kỹ thuật phục hình răng
720701,Quản lý bệnh viện
760101,Công tác xã hội
760102,Công tác thanh thiếu niên
810501,Kinh tế gia đình
840101,Khai thác vận tải
840104,Kinh tế vận tải
840106,Khoa học hàng hải
850101,Quản lý tài nguyên và môi trường
850102,Kinh tế tài nguyên thiên nhiên
850103,Quản lý đất đai
850201,Bảo hộ lao động
860102,Điều tra trinh sát
860104,Điều tra hình sự
860108,Kỹ thuật hình sự
860109,Quản lý nhà nước về an ninh trật tự
860111,Quản lý, giáo dục và cải tạo phạm nhân
860112,Tham mưu, chỉ huy vũ trang bảo vệ an ninh trật tự
860113,Phòng cháy chữa cháy và cứu hộ cứu nạn
860116,Hậu cần công an nhân dân
860117,Tình báo an ninh
860206,Biên phòng
860210,Chỉ huy tham mưu
860214,Chỉ huy kỹ thuật
860220,Tình báo quân sự
860226,Hậu cần quân sự